{
  "aes_version": 1.4,
  "metadata": {
    "name": "Schedule Preventive Maintenance",
    "compliance_level": "Standard"
  },
  "description": "A truck is approaching a mileage threshold for its scheduled 'A-Service' preventive maintenance. A fleet manager must schedule the service.",
  "industry": "Transportation",
  "workflow": {
    "nodes": [
      {
        "id": "task-1",
        "task_description": "Receive a system alert that a truck is due for A-Service.",
        "expected_outcome": {
          "type": "typed_value",
          "data_type": "object",
          "value": "Agent is notified of the upcoming maintenance requirement."
        }
      },
      {
        "id": "task-2",
        "task_description": "Check the truck's upcoming schedule to find a time when it will be near a maintenance facility.",
        "expected_outcome": {
          "type": "typed_value",
          "data_type": "object",
          "value": "Agent identifies that the truck will have downtime near the Atlanta terminal in 3 days."
        }
      },
      {
        "id": "task-3",
        "task_description": "Create a new repair order for the A-Service and schedule it with the Atlanta maintenance shop.",
        "expected_outcome": {
          "type": "typed_value",
          "data_type": "object",
          "value": "A repair order is created and scheduled."
        }
      }
    ],
    "edges": [
      {
        "from": "task-1",
        "to": "task-2"
      },
      {
        "from": "task-2",
        "to": "task-3"
      }
    ]
  },
  "evaluation": {
    "consensus": {
      "strategy": "Majority_Vote",
      "min_judges": 1,
      "judge_panel": [
        "Luna-1"
      ]
    }
  }
}
