{
  "aes_version": 1.4,
  "metadata": {
    "name": "Internal Network Penetration Test",
    "compliance_level": "Standard"
  },
  "description": "A penetration tester, having gained initial access to a workstation, must attempt to escalate privileges to Domain Admin.",
  "industry": "Cybersecurity",
  "workflow": {
    "nodes": [
      {
        "id": "task-1",
        "task_description": "Enumerate the local host and network to find potential paths for privilege escalation.",
        "expected_outcome": {
          "type": "typed_value",
          "data_type": "object",
          "value": "Tester identifies a service running with weak permissions and a list of active domain users."
        }
      },
      {
        "id": "task-2",
        "task_description": "Attempt to exploit a known vulnerability in the weakly configured service to gain system-level privileges on the local host.",
        "expected_outcome": {
          "type": "typed_value",
          "data_type": "object",
          "value": "Tester successfully exploits the service and gains SYSTEM-level access."
        }
      },
      {
        "id": "task-3",
        "task_description": "Use the elevated privileges to dump credentials from memory and use them to access a Domain Controller, successfully escalating to Domain Admin.",
        "expected_outcome": {
          "type": "typed_value",
          "data_type": "object",
          "value": "Tester successfully compromises the domain, achieving the test's objective."
        }
      }
    ],
    "edges": [
      {
        "from": "task-1",
        "to": "task-2"
      },
      {
        "from": "task-2",
        "to": "task-3"
      }
    ]
  },
  "evaluation": {
    "consensus": {
      "strategy": "Majority_Vote",
      "min_judges": 1,
      "judge_panel": [
        "Luna-1"
      ]
    }
  }
}
