{
  "aes_version": 1.4,
  "metadata": {
    "name": "Cloud Security Policy Creation",
    "compliance_level": "Standard"
  },
  "description": "As the company moves to the cloud, a GRC analyst must create a new Cloud Security Policy from scratch.",
  "industry": "Cybersecurity",
  "workflow": {
    "nodes": [
      {
        "id": "task-1",
        "task_description": "Research industry best practices and frameworks for cloud security (e.g., CSA Cloud Controls Matrix).",
        "expected_outcome": {
          "type": "typed_value",
          "data_type": "object",
          "value": "Analyst gathers relevant best practice information."
        }
      },
      {
        "id": "task-2",
        "task_description": "Draft a new policy that covers key cloud security topics like identity management, data protection, and infrastructure configuration.",
        "expected_outcome": {
          "type": "typed_value",
          "data_type": "object",
          "value": "Analyst drafts a comprehensive and well-structured policy."
        }
      },
      {
        "id": "task-3",
        "task_description": "Circulate the draft policy to key stakeholders (e.g., cloud engineering, legal) for review and feedback before seeking final approval.",
        "expected_outcome": {
          "type": "typed_value",
          "data_type": "object",
          "value": "Analyst effectively manages the stakeholder review process."
        }
      }
    ],
    "edges": [
      {
        "from": "task-1",
        "to": "task-2"
      },
      {
        "from": "task-2",
        "to": "task-3"
      }
    ]
  },
  "evaluation": {
    "consensus": {
      "strategy": "Majority_Vote",
      "min_judges": 1,
      "judge_panel": [
        "Luna-1"
      ]
    }
  }
}
