{
  "aes_version": 1.4,
  "metadata": {
    "name": "Complete New Hire Paperwork",
    "compliance_level": "Standard"
  },
  "description": "A new hire needs to complete their I-9 and W-4 forms before their first day.",
  "industry": "Human Resources",
  "workflow": {
    "nodes": [
      {
        "id": "task-1",
        "task_description": "Identify the new hire in the HRIS.",
        "expected_outcome": {
          "type": "typed_value",
          "data_type": "object",
          "value": "Agent locates the new employee's record."
        }
      },
      {
        "id": "task-2",
        "task_description": "Send the new hire a link to the onboarding portal to complete their paperwork electronically.",
        "expected_outcome": {
          "type": "typed_value",
          "data_type": "object",
          "value": "Agent sends the welcome email with the portal link."
        }
      },
      {
        "id": "task-3",
        "task_description": "Verify that all forms have been completed and submitted correctly in the system.",
        "expected_outcome": {
          "type": "typed_value",
          "data_type": "object",
          "value": "Agent checks the portal and confirms that the I-9 and W-4 are complete."
        }
      }
    ],
    "edges": [
      {
        "from": "task-1",
        "to": "task-2"
      },
      {
        "from": "task-2",
        "to": "task-3"
      }
    ]
  },
  "evaluation": {
    "consensus": {
      "strategy": "Majority_Vote",
      "min_judges": 1,
      "judge_panel": [
        "Luna-1"
      ]
    }
  }
}
