{
  "aes_version": 1.4,
  "metadata": {
    "name": "Optimize Underground Development",
    "compliance_level": "Standard",
    "id": "12677-optimize-underground-development"
  },
  "description": "A planning engineer optimizes the layout of access tunnels (development) in an underground mine to minimize cost while providing access to all planned stopes.",
  "industry": "Mining",
  "workflow": {
    "nodes": [
      {
        "id": "task-1",
        "task_description": "Import the final stope designs for the section of the mine to be developed.",
        "expected_outcome": [
          {
            "target": "message",
            "expected": "All target ore bodies (stopes) are loaded into the design software.",
            "mode": "regex"
          }
        ]
      },
      {
        "id": "task-2",
        "task_description": "Use an automated tool to generate a network of development tunnels that connects all the stopes.",
        "expected_outcome": [
          {
            "target": "message",
            "expected": "A preliminary network of access tunnels is created.",
            "mode": "regex"
          }
        ]
      },
      {
        "id": "task-3",
        "task_description": "Analyze the generated network and manually refine it to ensure it is practical and meets all design constraints.",
        "expected_outcome": [
          {
            "target": "message",
            "expected": "A final, cost-effective, and practical development design is produced.",
            "mode": "regex"
          }
        ]
      }
    ],
    "edges": [
      {
        "from": "task-1",
        "to": "task-2"
      },
      {
        "from": "task-2",
        "to": "task-3"
      }
    ]
  },
  "evaluation": {
    "consensus": {
      "strategy": "Majority_Vote",
      "min_judges": 1,
      "judge_panel": [
        "Luna-1"
      ]
    }
  }
}