{
  "aes_version": 1.4,
  "metadata": {
    "name": "Perform an Advisory Review",
    "compliance_level": "Standard",
    "id": "10381-perform-advisory-review"
  },
  "description": "A business unit is planning a major new process and asks internal audit to perform an advisory review to identify potential risks upfront.",
  "industry": "Audit",
  "workflow": {
    "nodes": [
      {
        "id": "task-1",
        "task_description": "Meet with the project team to understand the goals and design of the new process.",
        "expected_outcome": {
          "type": "typed_value",
          "data_type": "object",
          "value": "The auditor understands the proposed process."
        }
      },
      {
        "id": "task-2",
        "task_description": "Facilitate a risk assessment workshop to identify potential control gaps or weaknesses in the proposed design.",
        "expected_outcome": {
          "type": "typed_value",
          "data_type": "object",
          "value": "The workshop identifies a potential lack of segregation of duties in the proposed workflow."
        }
      },
      {
        "id": "task-3",
        "task_description": "Provide a memo with recommendations for improving the control design before the process is implemented. (Note: In an advisory review, these are recommendations, not formal findings).",
        "expected_outcome": {
          "type": "typed_value",
          "data_type": "object",
          "value": "The project team receives valuable input to build a more controlled process from the start."
        }
      }
    ],
    "edges": [
      {
        "from": "task-1",
        "to": "task-2"
      },
      {
        "from": "task-2",
        "to": "task-3"
      }
    ]
  },
  "evaluation": {
    "consensus": {
      "strategy": "Majority_Vote",
      "min_judges": 1,
      "judge_panel": [
        "Luna-1"
      ]
    }
  }
}