{
  "aes_version": 1.4,
  "metadata": {
    "name": "Clone Ad Set for A/B Testing",
    "compliance_level": "Standard",
    "id": "12433-clone-ad-set-for-testing"
  },
  "description": "A media buyer wants to test a new audience. They need to clone an existing ad set and change only the targeting.",
  "industry": "Marketing and Advertising",
  "workflow": {
    "nodes": [
      {
        "id": "task-1",
        "task_description": "Locate the original ad set in the campaign.",
        "expected_outcome": [
          {
            "target": "message",
            "expected": "Agent finds the correct ad set to be duplicated.",
            "mode": "regex"
          }
        ]
      },
      {
        "id": "task-2",
        "task_description": "Duplicate the ad set.",
        "expected_outcome": [
          {
            "target": "message",
            "expected": "Agent successfully creates a copy of the ad set, including its ads.",
            "mode": "regex"
          }
        ]
      },
      {
        "id": "task-3",
        "task_description": "In the new (cloned) ad set, change the audience targeting to the new test audience.",
        "expected_outcome": [
          {
            "target": "message",
            "expected": "Agent updates the targeting without changing the ad creative or other settings.",
            "mode": "regex"
          }
        ]
      },
      {
        "id": "task-4",
        "task_description": "Activate the new ad set.",
        "expected_outcome": [
          {
            "target": "message",
            "expected": "Both the original and the new test ad set are now running.",
            "mode": "regex"
          }
        ]
      }
    ],
    "edges": [
      {
        "from": "task-1",
        "to": "task-2"
      },
      {
        "from": "task-2",
        "to": "task-3"
      },
      {
        "from": "task-3",
        "to": "task-4"
      }
    ]
  },
  "evaluation": {
    "consensus": {
      "strategy": "Majority_Vote",
      "min_judges": 1,
      "judge_panel": [
        "Luna-1"
      ]
    }
  }
}