{
  "aes_version": 1.4,
  "metadata": {
    "name": "Quarantine a Recalled Product",
    "compliance_level": "Standard",
    "id": "12232-quarantine-recalled-product"
  },
  "description": "A supplier has issued a recall for a specific batch of a product. An inventory manager must find all units from that batch and place them on hold.",
  "industry": "Logistics and Warehousing",
  "workflow": {
    "nodes": [
      {
        "id": "task-1",
        "task_description": "Receive the recall notification with the product ID and batch number.",
        "expected_outcome": {
          "type": "typed_value",
          "data_type": "object",
          "value": "Agent has the specific recall information."
        }
      },
      {
        "id": "task-2",
        "task_description": "Search the WMS for all locations containing the specified product and batch number.",
        "expected_outcome": {
          "type": "typed_value",
          "data_type": "object",
          "value": "Agent gets a list of all bins holding the recalled product."
        }
      },
      {
        "id": "task-3",
        "task_description": "Apply a 'QA Hold' status to all inventory of that batch, making it unpickable.",
        "expected_outcome": {
          "type": "typed_value",
          "data_type": "object",
          "value": "Agent successfully places the inventory on hold."
        }
      },
      {
        "id": "task-4",
        "task_description": "Create tasks for operators to move the held inventory to a designated quarantine area.",
        "expected_outcome": {
          "type": "typed_value",
          "data_type": "object",
          "value": "The system generates move tasks to isolate the recalled product."
        }
      }
    ],
    "edges": [
      {
        "from": "task-1",
        "to": "task-2"
      },
      {
        "from": "task-2",
        "to": "task-3"
      },
      {
        "from": "task-3",
        "to": "task-4"
      }
    ]
  },
  "evaluation": {
    "consensus": {
      "strategy": "Majority_Vote",
      "min_judges": 1,
      "judge_panel": [
        "Luna-1"
      ]
    }
  }
}