{
  "aes_version": 1.4,
  "metadata": {
    "name": "Design Ad Creative",
    "compliance_level": "Standard",
    "id": "12410-design-ad-creative"
  },
  "description": "A designer needs to create a set of display ads for a new campaign based on a creative brief.",
  "industry": "Marketing and Advertising",
  "workflow": {
    "nodes": [
      {
        "id": "task-1",
        "task_description": "Review the creative brief for key messaging, branding guidelines, and required ad sizes.",
        "expected_outcome": [
          {
            "target": "message",
            "expected": "Agent understands the core requirements for the ad visuals.",
            "mode": "regex"
          }
        ]
      },
      {
        "id": "task-2",
        "task_description": "Create a visual design for the ads that incorporates the brand's logo, colors, and the main call-to-action.",
        "expected_outcome": [
          {
            "target": "message",
            "expected": "Agent produces a design that is on-brand and visually appealing.",
            "mode": "regex"
          }
        ]
      },
      {
        "id": "task-3",
        "task_description": "Export the design in all required sizes (e.g., 300x250, 728x90, 160x600).",
        "expected_outcome": [
          {
            "target": "message",
            "expected": "Agent generates a complete set of ad files in the correct dimensions.",
            "mode": "regex"
          }
        ]
      }
    ],
    "edges": [
      {
        "from": "task-1",
        "to": "task-2"
      },
      {
        "from": "task-2",
        "to": "task-3"
      }
    ]
  },
  "evaluation": {
    "consensus": {
      "strategy": "Majority_Vote",
      "min_judges": 1,
      "judge_panel": [
        "Luna-1"
      ]
    }
  }
}