{
  "aes_version": 1.4,
  "metadata": {
    "name": "Perform Metallurgical Bottle Roll Test",
    "compliance_level": "Standard"
  },
  "description": "A lab technician performs a bottle roll test on a new ore sample to determine its leach characteristics and potential gold recovery.",
  "industry": "Mining",
  "workflow": {
    "nodes": [
      {
        "id": "task-1",
        "task_description": "Prepare the ore sample by crushing and grinding it to the target particle size.",
        "expected_outcome": {
          "type": "typed_value",
          "data_type": "object",
          "value": "The sample is correctly prepared for the test."
        }
      },
      {
        "id": "task-2",
        "task_description": "Place the sample in a bottle with a cyanide solution and place it on rollers for a set amount of time (e.g., 24 hours).",
        "expected_outcome": {
          "type": "typed_value",
          "data_type": "object",
          "value": "The leach test is set up and run according to standard procedure."
        }
      },
      {
        "id": "task-3",
        "task_description": "After the test, assay the remaining solids and the solution to calculate the final gold extraction.",
        "expected_outcome": {
          "type": "typed_value",
          "data_type": "object",
          "value": "The test results are calculated, showing a 92% gold extraction for this ore type."
        }
      }
    ],
    "edges": [
      {
        "from": "task-1",
        "to": "task-2"
      },
      {
        "from": "task-2",
        "to": "task-3"
      }
    ]
  },
  "evaluation": {
    "consensus": {
      "strategy": "Majority_Vote",
      "min_judges": 1,
      "judge_panel": [
        "Luna-1"
      ]
    }
  }
}
