{
  "aes_version": 1.4,
  "metadata": {
    "name": "Create a Brand Guidelines Document",
    "compliance_level": "Standard"
  },
  "description": "A brand manager needs to create a comprehensive document outlining the brand's visual identity.",
  "industry": "Marketing and Advertising",
  "workflow": {
    "nodes": [
      {
        "id": "task-1",
        "task_description": "Gather all core brand assets: logo files, color palette (hex codes), and font families.",
        "expected_outcome": {
          "type": "typed_value",
          "data_type": "object",
          "value": "Agent collects all the necessary brand assets."
        }
      },
      {
        "id": "task-2",
        "task_description": "Create a document that specifies rules for logo usage (e.g., clear space, minimum size).",
        "expected_outcome": {
          "type": "typed_value",
          "data_type": "object",
          "value": "Agent clearly defines how the logo should and should not be used."
        }
      },
      {
        "id": "task-3",
        "task_description": "Add sections for the primary and secondary color palettes and typography rules (e.g., font sizes for headlines vs. body text).",
        "expected_outcome": {
          "type": "typed_value",
          "data_type": "object",
          "value": "Agent creates a complete visual style guide."
        }
      }
    ],
    "edges": [
      {
        "from": "task-1",
        "to": "task-2"
      },
      {
        "from": "task-2",
        "to": "task-3"
      }
    ]
  },
  "evaluation": {
    "consensus": {
      "strategy": "Majority_Vote",
      "min_judges": 1,
      "judge_panel": [
        "Luna-1"
      ]
    }
  }
}
