{
  "aes_version": 1.4,
  "metadata": {
    "name": "Create a Virtual Data Room for M&A",
    "compliance_level": "Standard",
    "id": "12149-create-data-room-for-ma"
  },
  "description": "In an M&A deal, the seller's counsel needs to set up a virtual data room (VDR) for the buyer to conduct due diligence.",
  "industry": "Legal",
  "workflow": {
    "nodes": [
      {
        "id": "task-1",
        "task_description": "Create a new VDR and set up a folder structure based on a standard due diligence checklist (e.g., 'Corporate Records', 'Material Contracts', 'IP').",
        "expected_outcome": {
          "type": "typed_value",
          "data_type": "object",
          "value": "Agent creates an organized VDR."
        }
      },
      {
        "id": "task-2",
        "task_description": "Upload all the relevant company documents into the appropriate folders.",
        "expected_outcome": {
          "type": "typed_value",
          "data_type": "object",
          "value": "Agent populates the VDR with the diligence materials."
        }
      },
      {
        "id": "task-3",
        "task_description": "Set up user accounts for the buyer's legal team and grant them 'view only' access to the documents.",
        "expected_outcome": {
          "type": "typed_value",
          "data_type": "object",
          "value": "Agent manages user permissions to securely share the documents."
        }
      }
    ],
    "edges": [
      {
        "from": "task-1",
        "to": "task-2"
      },
      {
        "from": "task-2",
        "to": "task-3"
      }
    ]
  },
  "evaluation": {
    "consensus": {
      "strategy": "Majority_Vote",
      "min_judges": 1,
      "judge_panel": [
        "Luna-1"
      ]
    }
  }
}