{
  "aes_version": 1.4,
  "metadata": {
    "name": "Audit Fleet Vehicle Usage",
    "compliance_level": "Standard",
    "id": "10320-audit-fleet-vehicle-usage"
  },
  "description": "An operational auditor reviews the usage of the company's fleet of service vehicles to identify potential misuse or inefficiency.",
  "industry": "Audit",
  "workflow": {
    "nodes": [
      {
        "id": "task-1",
        "task_description": "Obtain and analyze GPS tracking data and fuel card usage data for all fleet vehicles for the past 3 months.",
        "expected_outcome": {
          "type": "typed_value",
          "data_type": "object",
          "value": "Auditor has the complete dataset for analysis."
        }
      },
      {
        "id": "task-2",
        "task_description": "Analyze the data to identify vehicles with excessive idle times, off-hours usage, or significant deviations from their service routes.",
        "expected_outcome": {
          "type": "typed_value",
          "data_type": "object",
          "value": "The analysis flags 5 vehicles with significant weekend usage."
        }
      },
      {
        "id": "task-3",
        "task_description": "Recommend stronger controls over vehicle usage, such as a clearer policy on personal use and geofencing alerts.",
        "expected_outcome": {
          "type": "typed_value",
          "data_type": "object",
          "value": "The auditor proposes specific recommendations to reduce misuse."
        }
      }
    ],
    "edges": [
      {
        "from": "task-1",
        "to": "task-2"
      },
      {
        "from": "task-2",
        "to": "task-3"
      }
    ]
  },
  "evaluation": {
    "consensus": {
      "strategy": "Majority_Vote",
      "min_judges": 1,
      "judge_panel": [
        "Luna-1"
      ]
    }
  }
}