{
  "aes_version": 1.4,
  "metadata": {
    "name": "Install Heavy Machinery",
    "compliance_level": "Standard",
    "id": "11440-install-heavy-machinery"
  },
  "description": "A field crew needs to install and align a large industrial motor and pump set.",
  "industry": "Heavy Industries",
  "workflow": {
    "nodes": [
      {
        "id": "task-1",
        "task_description": "Retrieve the installation drawing for the motor and pump.",
        "expected_outcome": {
          "type": "typed_value",
          "data_type": "object",
          "value": "The crew gets the drawing showing the required location and orientation."
        }
      },
      {
        "id": "task-2",
        "task_description": "Set the motor and pump on the concrete base and perform a rough alignment.",
        "expected_outcome": {
          "type": "typed_value",
          "data_type": "object",
          "value": "The crew physically places the equipment."
        }
      },
      {
        "id": "task-3",
        "task_description": "Use a laser alignment tool to precisely align the motor and pump shafts, then log the final alignment values in the quality record.",
        "expected_outcome": {
          "type": "typed_value",
          "data_type": "object",
          "value": "The crew performs the precision alignment and documents that the final values are within the required tolerance."
        }
      }
    ],
    "edges": [
      {
        "from": "task-1",
        "to": "task-2"
      },
      {
        "from": "task-2",
        "to": "task-3"
      }
    ]
  },
  "evaluation": {
    "consensus": {
      "strategy": "Majority_Vote",
      "min_judges": 1,
      "judge_panel": [
        "Luna-1"
      ]
    }
  }
}