{
  "aes_version": 1.4,
  "metadata": {
    "name": "Handle a Property Damage Claim from a Third Party",
    "compliance_level": "Standard",
    "id": "11946-handle-property-damage-claim"
  },
  "description": "A person claims your insured driver backed into their car in a parking lot and is filing a claim against your insured's policy.",
  "industry": "Insurance",
  "workflow": {
    "nodes": [
      {
        "id": "task-1",
        "task_description": "Gather information from the third-party claimant and identify your insured's policy.",
        "expected_outcome": {
          "type": "typed_value",
          "data_type": "object",
          "value": "The adjuster creates a new claim and links it to the correct policyholder."
        }
      },
      {
        "id": "task-2",
        "task_description": "Contact the insured policyholder to get their statement about the incident.",
        "expected_outcome": {
          "type": "typed_value",
          "data_type": "object",
          "value": "The adjuster speaks with the insured, who confirms they did back into the other car."
        }
      },
      {
        "id": "task-3",
        "task_description": "Accept liability and arrange for an appraiser to inspect the claimant's vehicle.",
        "expected_outcome": {
          "type": "typed_value",
          "data_type": "object",
          "value": "The adjuster accepts liability and schedules an inspection of the third-party's vehicle."
        }
      }
    ],
    "edges": [
      {
        "from": "task-1",
        "to": "task-2"
      },
      {
        "from": "task-2",
        "to": "task-3"
      }
    ]
  },
  "evaluation": {
    "consensus": {
      "strategy": "Majority_Vote",
      "min_judges": 1,
      "judge_panel": [
        "Luna-1"
      ]
    }
  }
}