{
  "aes_version": 1.4,
  "metadata": {
    "name": "EV Charging Billing Dispute",
    "compliance_level": "Standard"
  },
  "description": "A customer claims they were overcharged for a public EV charging session.",
  "industry": "Energy",
  "workflow": {
    "nodes": [
      {
        "id": "task-1",
        "task_description": "Retrieve the charging session details using the customer's account ID and the date of the session.",
        "expected_outcome": {
          "type": "typed_value",
          "data_type": "object",
          "value": "Agent pulls the session record showing start time, end time, and kWh delivered."
        }
      },
      {
        "id": "task-2",
        "task_description": "Verify the pricing rate applied during the session against the published rates for that charger and time.",
        "expected_outcome": {
          "type": "typed_value",
          "data_type": "object",
          "value": "Agent confirms the correct time-of-use rate was applied."
        }
      },
      {
        "id": "task-3",
        "task_description": "Explain the charges to the customer, breaking down the cost based on energy consumed and any session fees.",
        "expected_outcome": {
          "type": "typed_value",
          "data_type": "object",
          "value": "Agent clearly communicates the calculation of the final bill."
        }
      }
    ],
    "edges": [
      {
        "from": "task-1",
        "to": "task-2"
      },
      {
        "from": "task-2",
        "to": "task-3"
      }
    ]
  },
  "evaluation": {
    "consensus": {
      "strategy": "Majority_Vote",
      "min_judges": 1,
      "judge_panel": [
        "Luna-1"
      ]
    }
  }
}
