{
  "aes_version": 1.4,
  "metadata": {
    "name": "Prepare for an Animal Welfare Audit",
    "compliance_level": "Standard",
    "id": "10191-animal-welfare-audit"
  },
  "description": "A pork producer is preparing for a third-party animal welfare audit and needs to ensure all documentation is in order.",
  "industry": "Agriculture",
  "workflow": {
    "nodes": [
      {
        "id": "task-1",
        "task_description": "Retrieve the checklist for the specific animal welfare audit standard (e.g., PQA Plus).",
        "expected_outcome": {
          "type": "typed_value",
          "data_type": "object",
          "value": "Agent gets the official audit checklist."
        }
      },
      {
        "id": "task-2",
        "task_description": "For each item on the checklist, retrieve the corresponding farm records, such as treatment records, training logs, and SOPs.",
        "expected_outcome": {
          "type": "typed_value",
          "data_type": "object",
          "value": "Agent gathers all the required documentation from the farm's records."
        }
      },
      {
        "id": "task-3",
        "task_description": "Compile all the documents into an organized package for the auditor and flag any areas where documentation is missing.",
        "expected_outcome": {
          "type": "typed_value",
          "data_type": "object",
          "value": "Agent creates a complete package and identifies one missing training log."
        }
      }
    ],
    "edges": [
      {
        "from": "task-1",
        "to": "task-2"
      },
      {
        "from": "task-2",
        "to": "task-3"
      }
    ]
  },
  "evaluation": {
    "consensus": {
      "strategy": "Majority_Vote",
      "min_judges": 1,
      "judge_panel": [
        "Luna-1"
      ]
    }
  }
}