{
  "aes_version": 1.4,
  "metadata": {
    "name": "Intraday Market Rebalancing",
    "compliance_level": "Standard"
  },
  "description": "A wind farm's generation is coming in lower than the day-ahead forecast. The trader must rebalance the position in the intraday market to avoid penalties.",
  "industry": "Energy",
  "workflow": {
    "nodes": [
      {
        "id": "task-1",
        "task_description": "Get the latest real-time generation data and the updated short-term forecast for the wind farm.",
        "expected_outcome": {
          "type": "typed_value",
          "data_type": "object",
          "value": "Agent confirms a 10 MW shortfall for the next 2 hours."
        }
      },
      {
        "id": "task-2",
        "task_description": "Check the intraday market prices to determine the cost of buying power to cover the shortfall.",
        "expected_outcome": {
          "type": "typed_value",
          "data_type": "object",
          "value": "Agent retrieves the current bid-ask spread for the relevant market product."
        }
      },
      {
        "id": "task-3",
        "task_description": "Execute a buy order on the intraday market to cover the 10 MW shortfall for the next two hours.",
        "expected_outcome": {
          "type": "typed_value",
          "data_type": "object",
          "value": "Agent successfully purchases the required energy."
        }
      }
    ],
    "edges": [
      {
        "from": "task-1",
        "to": "task-2"
      },
      {
        "from": "task-2",
        "to": "task-3"
      }
    ]
  },
  "evaluation": {
    "consensus": {
      "strategy": "Majority_Vote",
      "min_judges": 1,
      "judge_panel": [
        "Luna-1"
      ]
    }
  }
}
