{
  "aes_version": 1.4,
  "metadata": {
    "name": "Handle an Emergency Unmooring",
    "compliance_level": "Standard",
    "id": "12991-handle-emergency-unmooring"
  },
  "description": "A fire breaks out on a vessel at berth. The harbormaster orders an emergency unmooring to move the vessel away from the quay.",
  "industry": "Ports",
  "workflow": {
    "nodes": [
      {
        "id": "task-1",
        "task_description": "Receive the emergency order from the harbormaster to cast off the vessel immediately.",
        "expected_outcome": {
          "type": "typed_value",
          "data_type": "object",
          "value": "The mooring gang supervisor receives the urgent command."
        }
      },
      {
        "id": "task-2",
        "task_description": "Use emergency release hooks or, if necessary, cut the mooring lines to free the vessel.",
        "expected_outcome": {
          "type": "typed_value",
          "data_type": "object",
          "value": "The mooring lines are released as quickly as possible."
        }
      },
      {
        "id": "task-3",
        "task_description": "Confirm to the tugboats and pilot that the vessel is free so it can be towed away from the berth to a safe location.",
        "expected_outcome": {
          "type": "typed_value",
          "data_type": "object",
          "value": "The supervisor confirms 'all lines gone' so the emergency towage can begin."
        }
      }
    ],
    "edges": [
      {
        "from": "task-1",
        "to": "task-2"
      },
      {
        "from": "task-2",
        "to": "task-3"
      }
    ]
  },
  "evaluation": {
    "consensus": {
      "strategy": "Majority_Vote",
      "min_judges": 1,
      "judge_panel": [
        "Luna-1"
      ]
    }
  }
}