{
  "aes_version": 1.4,
  "metadata": {
    "name": "Verify Driver Identity with Selfie Check",
    "compliance_level": "Standard"
  },
  "description": "To prevent account sharing, a driver is randomly prompted to take a selfie to verify it matches their profile picture before they can go online.",
  "industry": "Transportation",
  "workflow": {
    "nodes": [
      {
        "id": "task-1",
        "task_description": "When a driver attempts to go online, the system randomly triggers an identity check.",
        "expected_outcome": {
          "type": "typed_value",
          "data_type": "object",
          "value": "The driver is prompted to take a selfie."
        }
      },
      {
        "id": "task-2",
        "task_description": "The driver takes a selfie using the app.",
        "expected_outcome": {
          "type": "typed_value",
          "data_type": "object",
          "value": "The image is captured."
        }
      },
      {
        "id": "task-3",
        "task_description": "The system uses facial recognition to compare the selfie with the driver's stored profile photo.",
        "expected_outcome": {
          "type": "typed_value",
          "data_type": "object",
          "value": "The system calculates a match score."
        }
      },
      {
        "id": "task-4",
        "task_description": "The match score is high, the identity is verified, and the driver is allowed to go online.",
        "expected_outcome": {
          "type": "typed_value",
          "data_type": "object",
          "value": "The driver successfully passes the check and can start working."
        }
      }
    ],
    "edges": [
      {
        "from": "task-1",
        "to": "task-2"
      },
      {
        "from": "task-2",
        "to": "task-3"
      },
      {
        "from": "task-3",
        "to": "task-4"
      }
    ]
  },
  "evaluation": {
    "consensus": {
      "strategy": "Majority_Vote",
      "min_judges": 1,
      "judge_panel": [
        "Luna-1"
      ]
    }
  }
}
