{
  "aes_version": 1.4,
  "metadata": {
    "name": "Troubleshooting - IPTV Pixelation",
    "compliance_level": "Standard",
    "id": "13820-iptv-pixelation-issue",
    "policies": {
      "max_spend_limit": 500,
      "requires_approval_for_destructive_actions": true
    }
  },
  "description": "A customer reports that their TV service is frequently pixelated, especially on HD channels.",
  "industry": "Telecom",
  "workflow": {
    "nodes": [
      {
        "id": "task-1",
        "task_description": "Identify the customer and their TV package.",
        "expected_outcome": [
          {
            "target": "message",
            "expected": "Agent confirms the customer has the 'Premium HD' TV package.",
            "mode": "regex"
          }
        ]
      },
      {
        "id": "task-2",
        "task_description": "Run a remote diagnostic on the customer's set-top box and home internet line.",
        "expected_outcome": [
          {
            "target": "message",
            "expected": "Diagnostic shows high bandwidth utilization on the internet line.",
            "mode": "regex"
          }
        ]
      },
      {
        "id": "task-3",
        "task_description": "Advise the customer to reduce other internet activity (e.g., large downloads) while watching TV or consider a speed upgrade.",
        "expected_outcome": [
          {
            "target": "message",
            "expected": "Agent correctly identifies the root cause and provides actionable advice.",
            "mode": "regex"
          }
        ]
      }
    ],
    "edges": [
      {
        "from": "task-1",
        "to": "task-2"
      },
      {
        "from": "task-2",
        "to": "task-3"
      }
    ]
  },
  "evaluation": {
    "consensus": {
      "strategy": "Majority_Vote",
      "min_judges": 1,
      "judge_panel": [
        "Luna-1"
      ]
    }
  },
  "initial_state": {
    "session_active": true,
    "user_authenticated": true,
    "system_status": "nominal"
  }
}