{
  "aes_version": 1.4,
  "metadata": {
    "name": "Manage Product Interface (Transmix)",
    "compliance_level": "Standard",
    "id": "12748-manage-product-quality-transmix"
  },
  "description": "When two different products (e.g., gasoline and diesel) are sent back-to-back in a pipeline, a mixture called 'transmix' is created at the interface. An operator must manage this.",
  "industry": "Oil and Gas",
  "workflow": {
    "nodes": [
      {
        "id": "task-1",
        "task_description": "Predict the arrival time and volume of the transmix batch at the downstream terminal.",
        "expected_outcome": [
          {
            "target": "message",
            "expected": "The system provides an accurate estimate of the transmix arrival and size.",
            "mode": "regex"
          }
        ]
      },
      {
        "id": "task-2",
        "task_description": "Instruct the terminal to line up the incoming stream to a dedicated transmix storage tank.",
        "expected_outcome": [
          {
            "target": "message",
            "expected": "The terminal confirms it is ready to receive the interface into the correct tank.",
            "mode": "regex"
          }
        ]
      },
      {
        "id": "task-3",
        "task_description": "Log the volume of transmix received for accounting and reprocessing purposes.",
        "expected_outcome": [
          {
            "target": "message",
            "expected": "The received transmix volume is accurately logged in the inventory system.",
            "mode": "regex"
          }
        ]
      }
    ],
    "edges": [
      {
        "from": "task-1",
        "to": "task-2"
      },
      {
        "from": "task-2",
        "to": "task-3"
      }
    ]
  },
  "evaluation": {
    "consensus": {
      "strategy": "Majority_Vote",
      "min_judges": 1,
      "judge_panel": [
        "Luna-1"
      ]
    }
  }
}