{
  "aes_version": 1.4,
  "metadata": {
    "name": "Swap Shifts with a Coworker",
    "compliance_level": "Standard",
    "id": "13413-swap-shifts-with-coworker"
  },
  "description": "An associate needs to swap their upcoming shift with a coworker.",
  "industry": "Retail",
  "workflow": {
    "nodes": [
      {
        "id": "task-1",
        "task_description": "Find a coworker who is willing to swap shifts.",
        "expected_outcome": [
          {
            "target": "message",
            "expected": "The associate makes an agreement with another employee.",
            "mode": "regex"
          }
        ]
      },
      {
        "id": "task-2",
        "task_description": "Log into the scheduling system and initiate a 'Shift Swap' request, selecting their shift and the coworker's shift.",
        "expected_outcome": [
          {
            "target": "message",
            "expected": "A formal swap request is created in the system.",
            "mode": "regex"
          }
        ]
      },
      {
        "id": "task-3",
        "task_description": "The request is sent to a manager for approval. Once approved, the schedules for both associates are updated.",
        "expected_outcome": [
          {
            "target": "message",
            "expected": "The shift swap is approved and reflected in the official schedule.",
            "mode": "regex"
          }
        ]
      }
    ],
    "edges": [
      {
        "from": "task-1",
        "to": "task-2"
      },
      {
        "from": "task-2",
        "to": "task-3"
      }
    ]
  },
  "evaluation": {
    "consensus": {
      "strategy": "Majority_Vote",
      "min_judges": 1,
      "judge_panel": [
        "Luna-1"
      ]
    }
  }
}